<?xml version="1.0"  encoding="US-ASCII"?>

<!DOCTYPE Policy SYSTEM "Policy.ldm.dtd" []>

<!-- Policies for 3ID-HHC -->

<Policies>

 <Policy name="THREEID-HHCCryptoPolicy" type="org.cougaar.core.security.CryptoPolicy">

   <!-- the following rule parameters will be used for the July demo -->

   <RuleParam name="secureMethod">
     <String value="signAndEncrypt"> </String>
   </RuleParam>

   <RuleParam name="symmetricAlgorithm">
     <String value="DESede"> </String>
   </RuleParam>

   <RuleParam name="asymmetricAlgorithm">
     <String value="RSA/ECB/PKCS#1"> </String>
   </RuleParam>

   <RuleParam name="signingAlgorithm">
     <String value="MD5withRSA"> </String>
   </RuleParam>

   <RuleParam name="messageSecurityManager">
     <String value="org.cougaar.core.society.PublicKeyMessageSecurityManager"> </String>
   </RuleParam>

   <RuleParam name="providerName">
     <String value=""> </String>
   </RuleParam>

 </Policy>

 <Policy name="THREEID-HHCAccessControlPolicy" type="org.cougaar.core.security.AccessControlPolicy">

   <RuleParam name="agentName">
     <String value="3ID-HHC"> </String>
   </RuleParam>

    <!--RuleParam name="ThreatConLevel">
      <RangeSet value="">
        <RangeValue min="2" max="2">
	  <RuleParam name="IncomingMessageAction">
      	    <KeySet value="">
	      <KeyValue key="Criticality0" value="ForwardTo:ALPHA-AIRLINES" />
	      <KeyValue key="Criticality1" value="ForwardTo:ALPHA-AIRLINES" />
	      <KeyValue key="Criticality2" value="ForwardTo:ALPHA-AIRLINES" />
	      <KeyValue key="Criticality3" value="AcceptMessage" />
	      <KeyValue key="Criticality4" value="AcceptMessage" />
	      <KeyValue key="Criticality5" value="AcceptMessage" />
    	    </KeySet>
  	  </RuleParam>
	</RangeValue>
        <RangeValue min="3" max="3">
	  <RuleParam name="IncomingMessageAction">
      	    <KeySet value="">
	      <KeyValue key="Criticality0" value="SetAside" />
	      <KeyValue key="Criticality1" value="SetAside" />
	      <KeyValue key="Criticality2" value="SetAside" />
	      <KeyValue key="Criticality3" value="SetAside" />
	      <KeyValue key="Criticality4" value="AcceptMessage" />
	      <KeyValue key="Criticality5" value="AcceptMessage" />
    	    </KeySet>
  	  </RuleParam>
	</RangeValue>
      </RangeSet>
    </RuleParam-->

    <RuleParam name="OutgoingMessageCriticality">
      <KeySet value="2">
        <KeyValue key="2-7-INFBN" value="3" />
        <KeyValue key="3-69-ARBN" value="4" />
      </KeySet>
    </RuleParam>

    <RuleParam name="OutgoingMessageIntegrity">
      <KeySet value="2">
        <KeyValue key="2-7-INFBN" value="3" />
        <KeyValue key="3-69-ARBN" value="4" />
      </KeySet>
    </RuleParam>

</Policy>

<!--</Policies>




    <RuleParam name="OutgoingMessageCriticality">
     <KeySet value="2">
       <KeyValue key="2-7-INFBN" value="3" />
       <KeyValue key="3-69-ARBN" value="4" />
     </KeySet>
   </RuleParam>
    <RuleParam name="OutgoingMessageIntegrity">
     <KeySet value="2">
       <KeyValue key="2-7-INFBN" value="3" />
       <KeyValue key="3-69-ARBN" value="4" />
     </KeySet>
    </RuleParam>
 </Policy> -->

</Policies>
