<?xml version="1.0"  encoding="US-ASCII"?>

<!DOCTYPE Policy SYSTEM "Policy.ldm.dtd" []>

<Policies>

 <Policy name="TRANSCOMCryptoPolicy" type="org.cougaar.core.security.policy.CryptoPolicy">

   <!-- the following rule parameters will be used for the July demo -->

   <RuleParam name="secureMethod">
     <KeySet value="sign">
       <KeyValue key="NCA" value="signAndEncrypt" />
       <KeyValue key="3ID-HHC" value="Encrypt" />
       <KeyValue key="ALPHA-AIRLINES" value="Encrypt" />
     </KeySet>
   </RuleParam>

   <RuleParam name="symmetricAlgorithm">
     <KeySet value="">
       <KeyValue key="NCA" value="DESede" />
       <KeyValue key="3ID-HHC" value="DESede" />
       <KeyValue key="ALPHA-AIRLINES" value="DES" />
     </KeySet>
   </RuleParam>

   <RuleParam name="asymmetricAlgorithm">
     <KeySet value="">
       <KeyValue key="NCA" value="RSA/ECB/PKCS#1" />
       <KeyValue key="3ID-HHC" value="RSA/ECB/PKCS#1" />
       <KeyValue key="ALPHA-AIRLINES" value="RSA/ECB/PKCS#1" />
     </KeySet>
   </RuleParam>

   <RuleParam name="signingAlgorithm">
     <KeySet value="MD5withRSA">
       <KeyValue key="NCA" value="MD5withRSA" />
       <KeyValue key="3ID-HHC" value="MD5withRSA" />
       <KeyValue key="ALPHA-AIRLINES" value="MD2withRSA" />
     </KeySet>
   </RuleParam>

   <RuleParam name="messageSecurityManager">
     <KeySet value="org.cougaar.core.society.PublicKeyMessageSecurityManager">
       <KeyValue key="NCA" value="org.cougaar.core.society.PublicKeyMessageSecurityManager" />
       <KeyValue key="3ID-HHC" value="org.cougaar.core.society.PublicKeyMessageSecurityManager" />
       <KeyValue key="ALPHA-AIRLINES" value="org.cougaar.core.society.PublicKeyMessageSecurityManager" />
     </KeySet>
   </RuleParam>

   <RuleParam name="providerName">
     <KeySet value="">
       <KeyValue key="NCA" value="" />
       <KeyValue key="3ID-HHC" value="" />
       <KeyValue key="ALPHA-AIRLINES" value="" />
     </KeySet>
   </RuleParam>

 </Policy>

</Policies>
