<?xml version="1.0"  encoding="US-ASCII"?>

<!DOCTYPE Policy SYSTEM "Policy.ldm.dtd" []>

<!-- Policies for 3-69-ARBN -->

<Policies>
 <Policy name="THREE-69-ARBNAccessControlPolicy" type="org.cougaar.core.security.AccessControlPolicy">

   <RuleParam name="agentName">
     <String value="3-69-ARBN"> </String>
   </RuleParam>

    <RuleParam name="OutgoingMessageCriticality">
      <Integer min="0" max="5" value="4" />
    </RuleParam>
    <RuleParam name="OutgoingMessageIntegrity">
      <Integer min="0" max="5" value="4" />
    </RuleParam>
 </Policy>


 <Policy name="THREE-69-ARBNCryptoPolicy" type="org.cougaar.core.security.CryptoPolicy">

   <!-- the following rule parameters will be used for the July demo -->

   <RuleParam name="secureMethod">
     <String value="signAndEncrypt"> </String>
   </RuleParam>

   <RuleParam name="symmetricAlgorithm">
     <String value="DESede"> </String>
   </RuleParam>

   <RuleParam name="asymmetricAlgorithm">
     <String value="RSA/ECB/PKCS#1"> </String>
   </RuleParam>

   <RuleParam name="signingAlgorithm">
     <String value="MD5withRSA"> </String>
   </RuleParam>

   <RuleParam name="messageSecurityManager">
     <String value="org.cougaar.core.society.PublicKeyMessageSecurityManager"> </String>
   </RuleParam>

   <RuleParam name="providerName">
     <String value=""> </String>
   </RuleParam>

 </Policy>

</Policies>
