<?xml version="1.0"  encoding="US-ASCII"?>

<!DOCTYPE Policy SYSTEM "Policy.ldm.dtd" []>

<Policies>

 <Policy name="DefaultCryptoPolicy" type="org.cougaar.core.security.policy.CryptoPolicy">

   <!-- the following rule parameters will be used for the July demo -->

   <RuleParam name="secureMethod">
     <String value="sign"> </String>
   </RuleParam>

   <RuleParam name="symmetricAlgorithm">
     <String value=""> </String>
   </RuleParam>

   <RuleParam name="asymmetricAlgorithm">
     <String value=""> </String>
   </RuleParam>

   <RuleParam name="signingAlgorithm">
     <String value="MD5withRSA"> </String>
   </RuleParam>

   <RuleParam name="messageSecurityManager">
     <String value="org.cougaar.core.society.PublicKeyMessageSecurityManager"> </String>
   </RuleParam>

   <RuleParam name="providerName">
     <String value=""> </String>
   </RuleParam>

 </Policy>

</Policies>
