<?xml version="1.0" encoding="UTF-8"?>

<!DOCTYPE Policies SYSTEM "Policy.ldm.dtd" []>

<!-- Policies for BOOTPOLICY -->

<Policies>
   <Policy name="BOOTPOLICY" type="org.cougaar.core.security.policy.CryptoPolicy">
      <RuleParam name="IncomingSecureMethod">
         <KeySet value="signAndEncrypt"/>
      </RuleParam>
      <RuleParam name="OutgoingSecureMethod">
         <KeySet value="signAndEncrypt"/>
      </RuleParam>
      <RuleParam name="IncomingSymmetricAlgorithm">
         <KeySet value="DES"/>
      </RuleParam>
      <RuleParam name="OutgoingSymmetricAlgorithm">
         <KeySet value="DES"><!-- PKCS#1 is not supported by the Cryptix library --></KeySet>
      </RuleParam>
      <RuleParam name="IncomingAsymmetricAlgorithm">
         <!-- <KeySet value="RSA/ECB/PKCS5Padding"> -->
         <!-- <KeySet value="RSA/ECB/PKCS#1"> (cryptix)-->
         <!-- <KeySet value="RSA/ECB/PKCS1Padding"> -->
         <!-- <KeySet value="ElGamal/ECB/PKCS#1"> -->
         <KeySet value="RSA/ECB/PKCS#1"/>
      </RuleParam>
      <!-- used to encrypt the session key -->
      <RuleParam name="OutgoingAsymmetricAlgorithm">
         <!-- PKCS#1 is not supported by the Cryptix library -->
         <KeySet value="RSA/ECB/PKCS#1"/>
      </RuleParam>
      <RuleParam name="IncomingSigningAlgorithm">
         <!-- Example of possible values:          MD2withRSA, MD5withRSA, or SHA1withRSA -->
         <KeySet value="MD5withRSA"/>
      </RuleParam>
      <RuleParam name="OutgoingSigningAlgorithm">
         <KeySet value="MD5withRSA"/>
      </RuleParam>
   </Policy>

</Policies>