<?xml version="1.0"  encoding="US-ASCII"?>

<!DOCTYPE Policy SYSTEM "Policy.ldm.dtd" []>

<Policies>

 <Policy name="3ID-HHCAccessControlPolicy" type="org.cougaar.core.security.policy.AccessControlPolicy">

    <RuleParam name="OutgoingMessageCriticality">
      <KeySet value="2">
        <KeyValue key="2-7-INFBN" value="3" />
        <KeyValue key="3-69-ARBN" value="4" />
      </KeySet>
    </RuleParam>

    <RuleParam name="OutgoingMessageIntegrity">
      <KeySet value="2">
        <KeyValue key="2-7-INFBN" value="3" />
        <KeyValue key="3-69-ARBN" value="4" />
      </KeySet>
    </RuleParam>

</Policy>

</Policies>
