<?xml version="1.0"  encoding="US-ASCII"?>

<!DOCTYPE Policy SYSTEM "Policy.ldm.dtd" []>

<Policies>

 <Policy name="24-SPTGP-HHCAccessControlPolicy" type="org.cougaar.core.security.policy.AccessControlPolicy">

	  <RuleParam name="IncomingMessageAction">
      	    <KeySet value="AcceptMessage">
    	    </KeySet>
  	  </RuleParam>

    <RuleParam name="IncomingMessageCriticality">
      <KeySet value="4">
        <KeyValue key="10-TCBN-HHC" value="3" />
      </KeySet>
    </RuleParam>

    <RuleParam name="IncomingMessageIntegrity">
      <KeySet value="4">
        <KeyValue key="10-TCBN-HHC" value="3" />
      </KeySet>
    </RuleParam>

 </Policy>

</Policies>
